{"components":[{"arguments":["serve","--state","/opt/remote-everything/.runtime/state/node"],"executable":"/opt/remote-everything/.runtime/bin/remote-everything-control","expected":{"listen_address":"127.0.0.1:58627","running":true},"id":"node","log":"/opt/remote-everything/.runtime/logs/node.log","managed":true,"manager":{"definition":"/home/remote_everything/.config/systemd/user/remote-everything-aaaaaaaa-node.service","id":"remote-everything-aaaaaaaa-node.service","type":"systemd-user"},"observed":{"listen_address":"127.0.0.1:58627","pid":1234,"started_at":"2026-01-01T00:01:00Z"},"sha256":"bbbbbbbbbbbbbbbbbbbbbbbbbbbbbbbbbbbbbbbbbbbbbbbbbbbbbbbbbbbbbbbb","verification":{"control_api":true},"working_directory":"/opt/remote-everything/.runtime"}],"created_at":"2026-01-01T00:00:00Z","dependencies":[{"id":"release-node","managed":true,"path":"/opt/remote-everything/.runtime/bin/remote-everything-control","sha256":"bbbbbbbbbbbbbbbbbbbbbbbbbbbbbbbbbbbbbbbbbbbbbbbbbbbbbbbbbbbbbbbb","source":"https://github.com/hxaxd/remote-everything/releases/tag/v2.0.0","version":"v2.0.0"}],"installation_id":"aaaaaaaaaaaaaaaaaaaaaaaaaaaaaaaaaaaaaaaaaaaaaaaaaaaaaaaaaaaaaaaa","integrations":[{"definition":"/home/remote_everything/.config/systemd/user/remote-everything-aaaaaaaa-node.service","id":"node-service","insertion":"whole-file","managed":true,"owner":"systemd-user","restore":"remove-file-and-user-daemon-reload","type":"service","verification":{"active":true}}],"mode":"lan","platform":"linux","release":{"source":"https://github.com/hxaxd/remote-everything/releases/tag/v2.0.0","tag":"v2.0.0"},"root":"/opt/remote-everything/.runtime","schema":1,"updated_at":"2026-01-01T00:02:00Z","verification":{"catalog":true}}
