{"components":[],"created_at":"2026-01-01T00:00:00Z","dependencies":[],"installation_id":"aaaaaaaaaaaaaaaaaaaaaaaaaaaaaaaaaaaaaaaaaaaaaaaaaaaaaaaaaaaaaaaa","integrations":[],"mode":"lan","platform":"linux","release":{"source":"https://github.com/hxaxd/remote-everything/releases/tag/v2.0.0","tag":"v2.0.0"},"root":"/opt/remote-everything/.runtime","schema":1,"updated_at":"2026-01-01T00:00:00Z","verification":{}}
